id,title,description,price,category,image,specs,skv,mrp,sale_price,features,stock
81,DS3231 RTC Module Without Coin Cell (AT24C32),"The DS3231 RTC module is a low-cost real-time clock that is commonly used with microcontrollers to keep track of real-world Date and Time. The module consists of two important ICs namely DS3231 and AT24C32 IC with a crystal oscillator, and a temperature sensor. The Time, Date and Temperature value from the module can be sent to a microcontroller like Arduino via I2C communication. This RTC Module with also available with battery.",75,Modules,DS3231 RTC Module Without Coin Cell (AT24C32).jpeg,,M21,150,75,,4
82,DS1307 Real-Time Clock RTC I2C Module AT24C32 ,"The DS1307 RTC Module is a low-power real-time clock designed for precise timekeeping. It keeps track of seconds, minutes, hours, day, date, month, and year, with automatic leap-year correction. The module communicates using the I2C interface, making it compatible with microcontrollers like Arduino, Raspberry Pi, and ESP8266. Additionally, it features an AT24C32 EEPROM for extra data storage and includes a CR2032 battery to retain timekeeping even when power is lost.",,,DS1307 Real-Time Clock RTC I2C Module AT24C32.jpeg,,,,,,
83,RTC CELL,Maxell CR2032 Lithium Manganese Dioxide Battery is an excellent choice for RTC or Computer Battery that supports relatively high capacity and low cutoff voltage than its counterparts. These 3V batteries have 220mAH of capacity with a standard discharge current of 0.2mA. This battery can be utilized upto 2.0V cutoff voltage. That means this battery could discharge fully upto 2.0V cutoff. The tentative discharge time for this battery is 800 hours approximately for a load of 10kOhms and 1250 hours for 15kOhms load. This battery has a 20mm diameter with 3.2mm of thickness (Height).,40,Miscellaneous,RTC CELL.jpeg,,M21A,80,40,,5
84,Ai Thinker Lora Module (RA-02) - 433Mhz,"When you want to send the data to long distances in range of thousands of meters with reasonably fast speed in range of hundreds of kbps and your requirement needs you to connect to multiple nodes at once. This LoRa-02 module is the most suitable for these applications as it employs spread spectrum technique technology to communicate with other modules, it is also very power efficient as it resists minimize current consumption. The LoRa thinker module is developed by AI-THINKER Technology which thanks to its LoRa modulation technology, has high sensitivity of -148dBm with a power output of +20dBm along with high transmission range and bulletproof reliability. It communicates with your controller with half duplex SPI communication with programmable bit rate of upto 300kbps. To protect it from stray magnetic fields it has a shielded housing. You can use it for IoT projects, smart homes, burglar alarms etc.",,Modules,Ai Thinker Lora Module (RA-02) - 433Mhz.jpeg,,M22,,,,0
85,NRF24L01 Transceiver Module,"Radio Frequency Modules are mostly used to add wireless capability to your project, you can use Wi-Fi modules or Bluetooth modules also but Radio Frequency modules will provide a longer range without the need of the internet and hence commonly used for RC control. This 2400 MHz RF Transceiver Module is ultra-low power RF transceiver IC for the ISM (Industrial Scientific and Medical) band. The nRF Module has a transmission range of about 200m. It communicates with SPI communication protocols. The nRF24L01 module is used in many applications like communication between two devices directly, home automation, wireless alarm systems, Robot control and monitoring systems, Remote sensing of temperatures and pressures or any sensor output, etc.",,Modules,NRF24L01 Transceiver Module.jpeg,,M22A,,,,0
86,STEP UP MODULE XL6009,"Voltage levels in AC can be changed much easier than in case of DC and with much more efficiency, it was one of the deciding factors in war of Currents between Edison and Tesla. But, with this XL6009 DC-DC Boost Converter is capable of driving a load current of upto 3A with excellent load and line regulation. This module operates at the frequency of 400kHz so the filter components are comparatively smaller compared to the other low frequency switching regulators. It can provide efficiency up to 92% which is very good for a switching regulator and its small size allows it to be used in portable electronics. It can be used in Battery charging circuits, Low power motor speed control circuits, Automotive applications etc.",55,Modules,STEP UP MODULE XL6009 .jpg,,M23,110,55,,3
87,STEP DOWN MODULW LM2596,"This is a DC-DC step-down buck converter power supply module based on the LM2596 Buck Converter IC. Most of the sensors, Development Boards like Arduino, Raspberry Pi, and PIC Controllers work on either 5V or 3.3V, most commonly available battery we have with us is 9V or 12V lead-acid batteries so it is essential that we supply the components with correct voltage, otherwise, they may misbehave or simply not work at all. Also, fluctuations in power supply will result in errors and garbage data from the sensors. It may also corrupt the SD card on which you are writing the data or cause your program to misbehave. This LM2596S module has an input voltage from 4V to 35V and stepped down-regulated output voltage from 1.25V to 30V. It operates on 150kHz switching frequency. The output voltage can be set by rotating the on-board blue color potentiometer. The main advantage of this module is that it can provide a high output current of up to 3A so that you can even connect small motors to it without thinking much but keep an eye on the heat dissipation of the module.",50,Modules,Step Down Module LM2596.jpeg,,M24,100,50,,5
88,CP2102 USB 2.0 to UART TTL Converter Module,"This USB to TTL adapter is based on the CP2102 USB to TTL serial converter IC. It is commonly used when microcontrollers like Arduino, Raspberry Pi, PIC etc have to communicate with computers through serial communication. As USB has DATA lines D+ and D- that can be connected and routed by CMOS switches. The USB can be connected to many peripheral devices and has a very fast speed of data transfer also it is used with Windows, Mac or any other operating system. On the other hand, Arduino and other microcontrollers works on UART data transfer protocol i.e. TTL logic level data transfer protocol it only works on 0V or 5V logic levels. That is why we need a USB to TTL serial converter IC so that Arduino or any other controller which work on UART protocol can be connected to the computer. It can also be used to program and or communicate with a GPS/GSM module through AT commands. The module supports both 3.3V and 5V interface.",,Modules,CP2102 USB 2.0 TO UART TTL Converter Module.jpeg,,M25,,,,2
89,FTDI232 FTDI Serial Adapter Module,"The FT232RL module is a small USB to TTL converter and used with different Arduino boards. The TTL is used to program Arduino boards. This has Six pins where the pins are used to communicate with other microcontrollers. The TTL converter has Data transfer rates from 300 baud to 3 Mbaud (RS422, RS485, RS232) at TTL levels.",110,Modules,RS232 to TTL Serial Interface Module.jpeg,,M25A,220,110,,3
90,RC522 RFID  Reader Writer Module,The Package includes a RC522 Reader/Write module with a RFID card and RFID keychain. The RC522 operates on 13.56MHz enabling two way (read and write) contact less communication with a transmission rate up to 424 Kbit/s. It also supports the ISO 14443A/MIFARE standards. It is commonly used in attendance systems and security systems to provide authorization. The specifications of the module are given below.,90,Modules,RC522 RFID Reader Writer Module.jpeg,,M26,180,90,,1
91,RS232 to TTL Serial Interface Module,"This RS232 to TTL Serial Interface Module is a board with the MAX3232 transceiver integrated circuit (IC). It facilitates serial communication between TTL and RS232 ports by providing the necessary electrical signal conversion.
These boards usually have a DB9 connector soldered at one end, and four header pins with jumper cables at the other end. The jumper cables enable the user to connect the wires to a breadboard or a microcontroller project board, whilst the DB9 connects directly to a COM port of a computer.
The MAX3232CSE+ IC, which comes in a 16 pin narrow SO package. It requires between 3.0 V to 5.5 V to operate and has two receivers and two transmitters. It has a maximum guaranteed data rate of 120 kbps, and the circuitry requires four 0.1µF charge-pump support capacitors. It is also compatible with the famous MAX3232 IC pins. These boards connect to systems with a UART  hence, they work with ATMEL and PIC microcontrollers.",,Modules,RS232 to TTL Serial Interface Module.jpeg,,M27,,,,0
92,RS485 to TTL Serial Port Converter Adapter Communication Module,"The TTL to RS485 Module, RS485 to TTL signal with Automatic Flow Control is a versatile device designed to facilitate seamless communication between TTL and RS485 signals. It simplifies the conversion process, making it as straightforward as operating a standard serial port. This module is compatible with both 3.3V and 5.0V power supplies and signals, offering flexibility in various applications.",,Modules,RS485 to TTL Serial Port Converter Adapter Communication Module.jpeg,,M28,,,,0
93,BMP180 Digital Barometric Pressure Sensor Module,"The BMP180 barometric sensor module (model GY-68) is a high precision sensor that can measure not only air pressure but also the temperature since temperature changes the density of air, so we need to compensate our readings for temperature change. Atmospheric pressure is nothing but the weight of air at that particular height per unit area. It is a very small module with dimensions being 1mm x 1.1mm (0.039in x 0.043in). It measures the absolute pressure of the air around it. It has a measuring range from 300 to 1100 hPa with an accuracy down to 0.02 hPa. It can also measure altitude and temperature and provide the data in digital form, which can be read with the I2C protocol. This module can be used in indoor navigation, sports devices, GPS, Weather Forecast, and Vertical velocity indication, etc.",50,Sensors,bmp180-barometric-pressure-sensor.jpg,,M29,100,50,,9
94,MPU-6050 Triple-Axis Accelerometer & Gyroscope Module,"The MPU6050 is an IMU (Inertial Estimation Unit) sensor, a portion of the Micro-Electro-Mechanical Systems (MEMS) family. It highlights a 3-axis accelerometer and a 3-axis gyroscope. The MPU-6050 module in addition called a magnetometer sensor. It can identify acceleration up in three measurements (X, Y, and Z) and also measure angular velocity around those axes. This motion-tracking device is often used in applications such as detecting the orientation of a device, detecting movement, and measuring angular velocity. The Inertial measurement unit sensor contains some additional circuitry for interfacing with a microcontroller or other device. The MPU6050 offers precise tracking for both quick and gradual movements. It includes a user-programmable gyroscope with a full-scale range of ±250, ±500, ±1000, and ±2000°/sec (DPS). Additionally, it features a user-programmable accelerometer with a full-scale range of ±2g, ±4g, ±8g, and ±16g.",130,Sensors,MPU-6050 Triple-Axis Accelerometer & Gyroscope Module.jpeg,,M29A,260,130,,3
95,TP4056 Battery Charger C Type Module with Protection,"The TP4056 is a complete constant-current/constant-voltage linear charger for single cell lithium-ion batteries. Its SOP package and low external component count make the TP4056 ideally suited for portable applications. The TP4056 can work with USB and wall adapter. No blocking diode is required due to the internal PMOSFET architecture and have prevent to negative Charge Current Circuit. Thermal feedback regulates the charge current to limit the die temperature during high power operation or high ambient temperature. The charge voltage is fixed at 4.2V, and the charge current can be programmed externally with a single resistor. The TP4056 automatically terminates the charge cycle when the charge current drops to 1/10th the programmed value after the final float voltage is reached.

",25,Modules,TP4056 Battery Charger C Type Module with Protection.jpeg,,M30,50,25,,5
96, TP4050 Mini USB Battery Charger e-274 ,"This TP4056 1A Li-ion Lithium Battery Charging Module with Current Protection – Mini USB is a tiny module, perfect for charging single cell 3.7V 1 Ah or higher lithium ion (Li-Ion) cells such as 16550s that don’t have their own protection circuit. Based on the TP4056 charger IC and DW01 battery protection IC this module will offer 1A charge current then cut off when finished. Furthermore, when the battery voltage drops below 2.4V the protection IC will switch the load off to protect the cell from running at too low of a voltage – and also protects against over-voltage and reverse polarity connection (it will usually destroy itself instead of the battery) however please check you have it connected correctly the first time",,,TP4050 Mini USB Battery Charger e-274 .jpg,,,,,,
97,MT8870 DTMF DECODER MODULE,"MT8870 DTMF Decoder Module is a very tiny module that is based on MT8870 DTMF decoder ic. The module offers a 3.5mm audio connector to connect an audio source. The DTMF Signal in the audio source is decoded and the digital outputs on the module, indicate the key pressed. You may connect a phone to the module and the module will output the key(0-9, *, #, A, B, C or D)pressed on the audio source. This module is suitable for modem interfaces, mobile radios and other DTMF related applications. Can be used to build mobile controlled robots, home automation projects, IVR style applications, etc This component is ideally suited to adding dual tone multi-frequency (DTMF) decoding to your project. This detection module interprets the incoming tone and produces a coded output that can be connected to all manner of microcontrollers. 
",100,Modules,MT8870 DTMF DECODER MODULE.jpg,,M30A,200,100,,1
98,5V Step-Up Power Module Lithium Battery Charging Protection Board USB For DIY Charger 134N3P,This is 5V Step-Up Power Module Lithium Battery Charging Protection Board USB For DIY Charger 134N3P. It’s a Lithium Battery Charging Protection Board Boost Converter LED Display USB For DIY Charger 134N3P & High-Quality USB iron with Cheap display port video card and Integrated Circuits.,,Modules,5v-step-up-power-module-lithium-battery-charging.jpg,,M30B,,,,
99,ESP01 MODULE,"This is a BIGTEETECH ESP-01S WIFI Module ESP8266 for SKR Octopus Control Board. ESP-01S  WIFI Module BIGTREETECH ESP8266 is a highly integrated chip and with the pre-flashed AT firmware, you can control the module through UART AT commands easily. The module integrates MCU inside, supports other developments like Lua/ Micro python/ Arduino to achieve flexible and fast prototyping, make it easy to integrate the module into IoT applications.This BIGTEETECH ESP-01S WIFI Module ESP8266 wireless module is designed to provide your device with a reliable and secure connection to Wi-Fi networks. It features an ESP8266 chip that supports 802.11 b/g/n standards and can reach speeds of up to 150 Mbps. The module also supports multiple security protocols, including WPA/WPA2, WEP, and WPA-PSK/WPA2-PSK. With its small size and low power consumption, this module is an ideal choice for your BIGTREETECH SKR Pro or TFT35.

",100,Modules,ESP01-wifi-module.jpg,,M31,200,100,,4
100,Micro USB to DIP Adapter Board,"MCU-Micro USB Breadboard 5V Power Supply Module 5Pin Female Connector B type PCB Converter. This breakout board is great for interfacing USB Signals with your custom-designed microcontroller boards. It also is useful if all you want is access to 5V USB power for your prototype circuits such as breadboards, perforated boards or Vero boards.",20,Modules,Micro USB to DIP Adapter Board.jpg,,M31A,40,20,,3
101,I2C MODULE,"This is a RoHS compliant I2C Serial LCD Daughter board that can be connected to a standard 16×2 or 20×4 Character Display Module that supports 4-bit mode. All Character Modules sold on our site support 4-bit mode, and nearly all commercially available 16×2 and 20×4 line character modules support it too. This board has a PCF8574 I2C chip that converts I2C serial data to parallel data for the LCD display. There are many examples on the internet for using this board with Arduino. Do a search for “Arduino LCD PCF8574“. The I2C address is 0x3F by default, but this can be changed via 3 solder jumpers provided on the board. This allows up to 3 LCD displays to be controlled via a single I2C bus (giving each one it’s own address)",65,Modules,I2C Module 16x2 lcd.jpg,,M32,130,65,,8
102,OLED Display Module,"Introducing the 0.96″ OLED Display Module. This display also provide a resolution of 128×64 pixels for clear visuals for your application. With its SPI/I2C interface and 7-pin design, it also offer flexibility and ease use in your project. Experience convenience and efficiency with the 0.96-inch SPI/I2C 7Pin OLED Display, designed for smooth communication and operation. Whether you’re working with Arduino, Raspberry Pi, or other microcontroller platform, this display module also ensure compatibility and reliability. Its compact size and blue OLED display add a touch of sophistication to your DIY electronics projects.",145,Displays,OLED Display.jpg,,M33,290,145,,5
103,16x2 LCD Display,"This is LCD 1602 Parallel LCD Display that provides a simple and cost-effective solution for adding a 16×2 White on Liquid Crystal Display into your project. The display is 16 character by 2 line display has a very clear and high contrast white text upon a blue background/backlight. This is great blue backlight LCD display. It is fantastic for Arduino based project. This LCD1602 LCD Display is very easy to interface with Arduino or Other Microcontrollers. This display overcomes the drawback of LCD 1602 Parallel LCD Display in which you’ll waste about 8 Pins on your Arduino for the display to get working. Luckily in this product, an I2C adapter is directly soldered right onto the pins of the display. So all you need to connect are the I2C pins, which shows a good library and little of coding.",100,Displays,16x2 LCD Display.jpg,,M34,200,100,,8
104,20x4 LCD Display,"If you want to add some visual output to your Arduino projects, you’ll need a display. If you need moderate data on display, the LCD2004 Parallel LCD Display is a quite good solution.This is LCD2004 Parallel LCD Display that provides a simple and cost-effective solution for adding a 20×4 Black on RGB Liquid Crystal Display into your project. The display is 20 character by 4 line display has a very clear and high contrast black text upon a yellow background/backlight.",360,Displays,20x4 LCD Display.jpg,,M34A,720,360,,0
105,433 MHZ RF Modules TX & RX PAIR,"This hybrid RF Transceiver Module provides a complete RF transmitter and receiver module solution which can be used to transmit data at up to 3KHz from any standard CMOS/TTL source. The transmitter module is very simple to operate and offers low current consumption (typical. 11mA). Data can be supplied directly from a microprocessor or encoding device, thus keeping the component count down and ensuring a low hardware cost. The RX – ASK is an ASK Hybrid receiver module. The RF Transmitter Receiver Module is an effective low-cost solution for using 433 MHz. The TX-ASK is an ASK hybrid transmitter module. TX-ASK is designed by the saw resonator, with an effective low cost, small size and simple to use for designing.",,Modules,433 MHZ RF Modules TX & RX PAIR.jpg,,M35,,,,0
106,WIRLESS CHARGING MODULE,,,Modules,,,M36,,,,
107,L298N 2A Motor Driver Module,"A microcontroller that normally operates on 5V or 3.3V cannot be directly used to control a DC motor operating on higher voltage and current rating. This is why we commonly use Motor Driver modules like the L293D Motor Driver Module and the L298N Motor Driver Module. While the L293D motor driver module can be used for basic low current application the L298N Motor driver module is a high current motor driver with some additional features that are commonly used with Arduino and Raspberry Pi for Robotics applications. The L298N Motor Driver module is based on the L298 Dual Full-Bridge Driver IC and can control the speed and direction of two DC motors (Motor A and Motor B) simultaneously. The voltage rating of these motors can be between 5V to 35V and the peak current value can be up to 2A. The pins Enable A and Enable B are used to set the speed of the motor. By default, there will be jumper pins connected to both Enable A and B to make them high (5V), this way the motors will rotate at maximum speed. You can adjust the speed of the motors by removing the jumper and providing a variable voltage between 0V to 5V by using a PWM signal.",100,Modules,L298N-motor-driver-module.jpg,,M37,200,100,,2
108,L293D Motor Driver/Servo Shield for Arduino,"The L293D Motor Driver/Servo Shield for Arduino is probably one of the most versatile on the market and features 2 servo and 4 motor connectors for DC or stepper motors. That makes it a great shield for any robotic project. This Arduino compatible motor Driver shield is a full-featured product that it can be used to drive 4 DC motor or two 4-wire steppers and two 5v servos. It drives the DC motor and stepper with the L293D, and it drives the servo with Arduino pin9 and pin10. The shield contains two L293D motor drivers and one 74HC595 shift register. The shift register expands 3 pins of the Arduino to 8 pins to control the direction of the motor drivers. The output enables the L293D is directly connected to the PWM outputs of the Arduino.",120,Modules,L293D Motor Driver .jpg,,M38,240,120,,1
109,L293D MOTOR DRIVER MODULE,,,Modules,,,M38A,,,,0
110,ULN2003 Stepper Motor Driver,"ULN2003 Stepper Motor Driver Board uses the ULN2003 DARLINGTON ARRAYS to drive the 4-phase 5-wire stepper motor (5v-12v). It’s easy to use Arduino or another development platform to drive the stepper motor by this diver board.                                                                                                      The 5 Line 4 Phase can be driven by an ordinary ULN2003 chip can also be connected in the phase 2 development board used for supporting the use of a direct plug and easy to use stepper motor used in the development board. A, B, C, D four-phase LED indicates the status of the stepper motor work.",40,Modules,ULN2003 Stepper Motor Driver.jpg,,M39,80,40,,3
111,DIGITAL VOLTMETER,,,Modules,,,M40,,,,0
112,NEO 6M GPS Module,"If you are wandering to navigate the distance with a drone then this GPS Module is needed for you. GPS drones are equipped with a GPS module that allows them to know their location relative to a network of orbiting satellites. Connecting to signals from these satellites allows the drone to perform functions such as position hold, autonomous flight, return to home, and waypoint navigation.                                                                                            This is a complete GPS module that is based on the NEO 6M GPS. This unit uses the latest technology to give the best possible positioning information and includes a larger built-in 25 x 25mm active GPS antenna with a UART TTL socket. A battery is also included so that you can obtain a GPS lock faster. This is an updated GPS module that can be used with ardupilot mega v2. This GPS module gives the best possible position information, allowing for better performance with your Ardupilot or other Multirotor control platform.",230,Modules,NEO 6M GPS Module.jpg,,M41,460,230,,5
113,4*4 KEYPAD,This 4×4 Membrane is a high-quality soft-touch feeling button keypad with 100 million life-stroke lifespans and good resistance to environmental conditions. This 4×4 Membrane Keypad is a high-quality product at a very low cost for your application needs.                                                                 This 16-button keypad provides a useful human interface component for microcontroller projects. Convenient adhesive backing provides a simple way to mount the keypad in a variety of applications.                                                                                                                                                                       The Keypad 4×4 features a total of 16 buttons in Matrix form. This is a membrane keypad with no moving parts. A female 8-pin berg connector is require for interfacing it with your microcontroller circuits.,55,Keypad,4x4 Matrix Keypad.jpg,,M42,110,55,,4
114,4*3 KEYPAD,"This DC 12V 4×3 Matrix 12 keys Membrane Switch Keypad is high-quality soft touch feeling button keypad with 100 million life-stroke lifespans and good resistance to environmental conditions.                                                                                                                                                                                      This DC 12V 4×3 Key Matrix Membrane Switch Keypad is a high-quality product at very low cost for your application needs.

This 12-button keypad provides a useful human interface component for microcontroller projects. Convenient adhesive backing provides a simple way to mount the keypad in a variety of applications.",,Keypad,4x3 Keypad.jpg,,M42A,,,,0
115,5V RELAY QUBE,"This is the 5V relay most commonly used as switching device in electronic circuits. It is mainly used in Commonly switching circuits, For Home Automation projects to switch AC loads, To Control (On/Off) Heavy loads at a pre-determined time/condition, Used in safety circuits to disconnect the load from supply in event of failure, Used in Automobiles electronics for controlling indicators glass motors.",50,Relays,,,M43,100,50,,15
116,12V RELAY QUBE,,,Relays,,,M44,,,,0
